199,0,1901,"Donec est. Nunc ullamcorper, velit",nec quam. Curabitur vel lectus. Cum sociis
298,0,1939,Nulla interdum. Curabitur dictum. Phasellus,Nam interdum enim non nisi. Aenean eget metus. In
397,0,1924,Phasellus,magna.
595,1,1959,Vestibulum ante ipsum primis in faucibus orci luctus et,Lorem
694,1,2012,"egestas, urna justo faucibus lectus,","aliquet lobortis, nisi nibh lacinia orci, consectetuer euismod"
793,0,1977,"non,","ultrices sit amet, risus. Donec"
1090,1,1910,"nunc, ullamcorper eu, euismod ac, fermentum vel, mauris. Integer sem","ultricies ligula. Nullam enim. Sed nulla ante,"
1288,0,2020,felis purus ac tellus.,magna. Phasellus dolor
1387,1,1900,"sagittis augue, eu tempor erat neque non quam.",ac mattis velit
1486,1,1955,Aliquam erat volutpat. Nulla dignissim. Maecenas ornare egestas ligula.,metus. Aenean sed pede nec ante
